{
  "name": "ZKP2P Vault List",
  "version": {
    "major": 1,
    "minor": 3,
    "patch": 1
  },
  "timestamp": "2026-03-26T12:52:00Z",
  "schema": "https://raw.githubusercontent.com/zkp2p/vault-list/main/schema/vault-list.schema.json",
  "vaults": [
    {
      "rateManagerId": "0x8666d6fb0f6797c56e95339fd7ca82fdd348b9db200e10a4c4aa0a0b879fc41c",
      "chainId": 8453,
      "rateManagerAddress": "0xeed7db23e724ac4590d6db6f78fda6db203535f3",
      "name": "Delegate by USDCtoFiat",
      "slug": "delegate-by-usdctofiat",
      "description": "Fully automated USDC vault running 24/7 across 34 currencies and 14 payment methods. Rates adapt to real-time market conditions and stay competitive without any manual intervention. Non-custodial, 0.10% fee.",
      "strategyShort": "AI-powered rate engine across 34 currencies and 14 payment methods",
      "strategyLong": "Delegate handles rate management so depositors don't have to. Once you delegate, the bot monitors market conditions and adjusts your rates automatically.\n\nRates are recalculated continuously using live FX data and on-chain spread analysis. The bot targets optimal positioning — competitive enough to attract fills, wide enough to protect your margin. If market conditions shift or competitors adjust, your rates respond automatically.\n\nYour USDC never leaves your deposit. Delegation only grants rate-setting permission — withdrawals, currency changes, and deposit management stay fully in your control. The vault cannot move, spend, or access your funds.",
      "manager": {
        "address": "0xC141Cbe4f4a9CAbc3cc78159a9268a4e008922CD",
        "name": "USDCtoFiat",
        "twitter": "usdctofiat"
      },
      "fee": "0.10%",
      "maxFee": "2.0%",
      "paymentMethods": [
        "revolut",
        "wise",
        "paypal",
        "venmo",
        "cashapp",
        "zelle-chase",
        "zelle-bofa",
        "zelle-citi",
        "mercadopago",
        "monzo",
        "n26",
        "chime",
        "luxon",
        "alipay"
      ],
      "currencies": [
        "AED",
        "ARS",
        "AUD",
        "BRL",
        "CAD",
        "CHF",
        "CNY",
        "CZK",
        "DKK",
        "EUR",
        "GBP",
        "HKD",
        "HUF",
        "IDR",
        "ILS",
        "INR",
        "JPY",
        "KES",
        "MXN",
        "MYR",
        "NOK",
        "NZD",
        "PHP",
        "PLN",
        "RON",
        "SAR",
        "SEK",
        "SGD",
        "THB",
        "TRY",
        "UGX",
        "USD",
        "VND",
        "ZAR"
      ],
      "riskLevel": "low",
      "tags": ["automated", "ai-managed", "non-custodial", "delegate"],
      "links": {
        "website": "https://delegate.usdctofiat.xyz",
        "docs": "https://delegate.usdctofiat.xyz/#learn",
        "twitter": "https://x.com/usdctofiat"
      },
      "logoURI": "https://usdctofiat.xyz/brand-icon.png"
    },
    {
      "rateManagerId": "0x65b1056ef2dbdcd3b5f9ac170bb89eb2718b3a7a09d7eb0160d15623cfeefc6e",
      "chainId": 8453,
      "rateManagerAddress": "0xeEd7Db23e724aC4590D6dB6F78fDa6DB203535F3",
      "name": "J.A.R.V.I.S Fund",
      "slug": "jarvis-fund",
      "description": "AI-managed USDC vault running autonomous rate strategies 24/7 across 14 payment platforms and 33 currencies. Non-custodial — deposits stay in Peer escrow at all times.",
      "strategyShort": "Autonomous AI rate management across all supported payment platforms and currencies",
      "strategyLong": "The J.A.R.V.I.S Fund uses a multi-strategy rate engine combining competitive analysis, time-weighted adjustments, volume-based positioning, and fill-rate feedback loops. Rates update continuously across 14 payment platforms and 33 currencies based on market conditions, timezone overlaps, and orderbook depth. All USDC remains in Peer on-chain escrow — the vault only manages rates, never custody.",
      "manager": {
        "address": "0xA9FdcE9d4583850a46532341e47024B9880F7005",
        "name": "J.A.R.V.I.S",
        "twitter": "0xSachinK"
      },
      "fee": "0.10%",
      "maxFee": "2.0%",
      "paymentMethods": [
        "venmo",
        "revolut",
        "cashapp",
        "wise",
        "mercadopago",
        "zelle-citi",
        "zelle-chase",
        "zelle-bofa",
        "paypal",
        "monzo",
        "n26",
        "alipay",
        "chime",
        "luxon"
      ],
      "currencies": [
        "AED",
        "ARS",
        "AUD",
        "CAD",
        "CHF",
        "CNY",
        "CZK",
        "DKK",
        "EUR",
        "GBP",
        "HKD",
        "HUF",
        "IDR",
        "ILS",
        "INR",
        "JPY",
        "KES",
        "MXN",
        "MYR",
        "NOK",
        "NZD",
        "PHP",
        "PLN",
        "RON",
        "SAR",
        "SEK",
        "SGD",
        "THB",
        "TRY",
        "UGX",
        "USD",
        "VND",
        "ZAR"
      ],
      "riskLevel": "low",
      "tags": ["automated", "ai-managed", "non-custodial"],
      "links": {
        "website": "https://jarvis.payhumans.ai",
        "twitter": "https://x.com/0xSachinK"
      }
    },
    {
      "rateManagerId": "0x91007c91265b09a7e59912a0730eccd984a4c39c294f3bb8ab812f81b1efe91c",
      "chainId": 8453,
      "rateManagerAddress": "0xeEd7Db23e724aC4590D6dB6F78fDa6DB203535F3",
      "name": "PeerBOOST",
      "slug": "peerboost",
      "description": "Automated USDC vault that manages rates at the sweet spot between returns and volume across all 14 Peer payment methods and 34 fiat currencies. PeerBOOST continuously monitors FX rates, market conditions, and orderbook depth to adjust positioning in real time, drawing on 5+ years of experience managing positions in TradFi markets.",
      "strategyShort": "Patient, high-return rate management for long-term LPs",
      "strategyLong": "PeerBOOST runs a patient rate strategy designed to optimize long-term LP returns rather than maximize fill volume at any cost. Rates are managed around the sweet spot where margins remain attractive while order flow stays healthy across supported payment methods and fiat routes. The system continuously monitors live FX rates, market conditions, and orderbook depth to adjust positioning as conditions change. The strategy draws on more than five years of experience managing positions in TradFi markets and is built for LPs who prefer consistent, disciplined positioning over aggressive short-term volume chasing.",
      "manager": {
        "address": "0x29d57aBA72Fc54323eCcb853BC257A9c18538C4F",
        "name": "PeerBOOST",
        "twitter": "m38mah"
      },
      "fee": "0.10%",
      "maxFee": "2.0%",
      "paymentMethods": [
        "alipay",
        "cashapp",
        "chime",
        "luxon",
        "mercadopago",
        "monzo",
        "n26",
        "paypal",
        "revolut",
        "venmo",
        "wise",
        "zelle-bofa",
        "zelle-chase",
        "zelle-citi"
      ],
      "currencies": [
        "AED",
        "ARS",
        "AUD",
        "BRL",
        "CAD",
        "CHF",
        "CNY",
        "CZK",
        "DKK",
        "EUR",
        "GBP",
        "HKD",
        "HUF",
        "IDR",
        "ILS",
        "INR",
        "JPY",
        "KES",
        "MXN",
        "MYR",
        "NOK",
        "NZD",
        "PHP",
        "PLN",
        "RON",
        "SAR",
        "SEK",
        "SGD",
        "THB",
        "TRY",
        "UGX",
        "USD",
        "VND",
        "ZAR"
      ],
      "riskLevel": "low",
      "tags": ["automated", "long-term", "high-return", "non-custodial"],
      "links": {
        "docs": "https://peerlytics.xyz/explorer/address/0xe88a10f155fed40df3b778ed68b144ea5b255ca3",
        "twitter": "https://x.com/m38mah"
      }
    }
  ]
}
